{
  "$schema": "https://json-schema.org/draft/2020-12/schema",
  "$id": "https://dolly.invalid/schemas/memory-factorial-v0-schema.json",
  "title": "Memory factorial deterministic representation preregistration",
  "type": "object",
  "additionalProperties": false,
  "required": [
    "$schema",
    "schemaVersion",
    "experimentId",
    "experimentVersion",
    "title",
    "status",
    "scope",
    "protocol",
    "authorityReferences",
    "definitions",
    "question",
    "hypotheses",
    "decision",
    "conditions",
    "data",
    "backend",
    "randomness",
    "metrics",
    "execution",
    "stoppingRules",
    "decisionRules",
    "artifacts",
    "independentValidation",
    "safetyBoundary",
    "domainDesign"
  ],
  "properties": {
    "$schema": { "const": "./memory-factorial-v0-schema.json" },
    "schemaVersion": { "const": "dolly-experiment-preregistration/v1" },
    "experimentId": { "const": "memory-factorial-v0" },
    "experimentVersion": { "const": 2 },
    "title": { "type": "string", "minLength": 20 },
    "status": { "const": "frozen-before-first-run" },
    "scope": { "const": "exploratory-component" },
    "protocol": {
      "type": "object",
      "additionalProperties": false,
      "required": ["path", "sha256"],
      "properties": {
        "path": { "const": "docs/experiments/protocol.md" },
        "sha256": { "type": "string", "pattern": "^[a-f0-9]{64}$" }
      }
    },
    "authorityReferences": { "type": "array", "minItems": 4, "items": { "type": "string", "minLength": 1 }, "uniqueItems": true },
    "definitions": { "type": "object", "minProperties": 4 },
    "question": { "type": "string", "minLength": 40 },
    "hypotheses": { "$ref": "#/$defs/nonemptyObject" },
    "decision": { "$ref": "#/$defs/nonemptyObject" },
    "conditions": { "$ref": "#/$defs/nonemptyObject" },
    "data": { "$ref": "#/$defs/nonemptyObject" },
    "backend": { "$ref": "#/$defs/nonemptyObject" },
    "randomness": { "$ref": "#/$defs/nonemptyObject" },
    "metrics": { "$ref": "#/$defs/nonemptyObject" },
    "execution": { "$ref": "#/$defs/nonemptyObject" },
    "stoppingRules": { "$ref": "#/$defs/nonemptyObject" },
    "decisionRules": { "$ref": "#/$defs/nonemptyObject" },
    "artifacts": { "$ref": "#/$defs/nonemptyObject" },
    "independentValidation": { "$ref": "#/$defs/nonemptyObject" },
    "safetyBoundary": { "$ref": "#/$defs/nonemptyObject" },
    "domainDesign": { "$ref": "#/$defs/nonemptyObject" }
  },
  "$defs": {
    "nonemptyObject": { "type": "object", "minProperties": 1 }
  }
}
