{
  "$schema": "./memory-factorial-v0-schema.json",
  "schemaVersion": "dolly-experiment-preregistration/v1",
  "experimentId": "memory-factorial-v0",
  "experimentVersion": 2,
  "title": "Deterministic confirmation of repeated-position evidence and task-state representations",
  "status": "frozen-before-first-run",
  "scope": "exploratory-component",
  "protocol": {
    "path": "docs/experiments/protocol.md",
    "sha256": "e5105404aafa581716e7767244ba458966b73597c4e8a02e6a64a0cbbdfa5e81"
  },
  "authorityReferences": [
    "AGENTS.md",
    ".qoder/specs/dolly_new.txt lines 91-117 and 180",
    ".qoder/specs/dolly_owner_addendum_20260801.txt",
    "docs/spec/memory-extension.md sections 10, 14, and 17",
    "docs/experiments/preregistrations/memory-association-task-switch-v0.json",
    "docs/research/memory-association-task-switch-v0.md",
    "docs/research/memory-factorial-v0-design.md"
  ],
  "definitions": {
    "repeated-position evidence": "Raw source records reached through token pairs that are adjacent in at least two distinct historical episodes; it records association, not causation.",
    "deterministic checkpoint": "A closed task-state object copied by deterministic rules from an association evidence packet and retaining the raw source identifiers for every claim.",
    "claim group": "One semantic claim with one or more independently sufficient source-identifier sets; the sets are logical alternatives, so duplicate equivalent sources do not multiply correctness.",
    "old-action use": "Resuming a stored action after an explicit do-not-resume cue or cancellation, or using the initial action after a later supersession record.",
    "reference reader": "A deterministic contract fixture that converts the bounded packet to the closed decision schema; it is not a language model or a Dolly product run.",
    "automatic resume": "Returning a resume decision with a closed operation and exact arguments without first asking for user confirmation."
  },
  "question": "On sixteen frozen scenarios spanning two task families and four explicit cue classes, does repeated-position raw evidence repair the content-only evidence deficit, and can a deterministic checkpoint or checkpoint-plus-raw representation preserve that result while meeting frozen safety and byte-cost gates?",
  "hypotheses": {
    "primary": [
      {
        "id": "h1-association-useful-effect",
        "statement": "Association raw evidence improves semantic case success over content raw by at least 0.25 absolute on the eight action-bearing positive and superseded scenarios, with no paired regression.",
        "outcomeMeasure": "semantic_case_success"
      },
      {
        "id": "h2-checkpoint-noninferiority",
        "statement": "The deterministic checkpoint loses at most one of sixteen cases versus association raw and reduces p95 UTF-8 evidence bytes by at least 0.25 relative.",
        "outcomeMeasure": "checkpoint_noninferiority"
      },
      {
        "id": "h3-composition-added-value",
        "statement": "Checkpoint plus association raw repairs at least two of eight action-bearing cases beyond association raw without any paired loss and remains within 1.50 times its p95 evidence bytes.",
        "outcomeMeasure": "composition_added_value"
      }
    ],
    "guardrails": [
      {
        "id": "g1-no-false-resume",
        "statement": "Every candidate representation has zero false resume across the eight explicit do-not-resume and cancelled scenarios.",
        "outcomeMeasure": "false_resume"
      },
      {
        "id": "g2-no-old-action-use",
        "statement": "Every candidate representation has zero old-action use across all do-not-resume, cancelled, and superseded scenarios.",
        "outcomeMeasure": "old_action_use"
      },
      {
        "id": "g3-source-closure",
        "statement": "Every cited raw source resolves through the condition packet and no unrelated or cross-claim citation is accepted.",
        "outcomeMeasure": "invalid_source_citation"
      }
    ]
  },
  "decision": {
    "currentProductState": "Earlier Aether pilot scoring mixed a natural-language action surface form with retrieval quality and counted equivalent repeated constraint citations as if both were required. This version isolates representation mechanics with a closed operation schema and claim-group OR-set scoring. No Memory product behavior is thereby supported.",
    "changesIfSupported": [
      "If association meets the useful-effect and all safety gates, retain it only as a source-cited experimental retrieval candidate for a later public Agent experiment.",
      "Select the deterministic checkpoint only if it also meets its noninferiority and 25 percent p95 byte-reduction gate; otherwise keep raw evidence.",
      "Add checkpoint plus association raw only if it repairs at least two paired cases and passes the 1.50-times byte gate.",
      "Keep automatic resume disabled until a separate public Agent and Dolly integration experiment passes cancellation, restart, deletion, isolation, and tool-effect boundaries."
    ],
    "changesIfRejected": [
      "If association does not improve at least two of eight action-bearing cases, do not add this repeated-position mechanism to Memory.",
      "If the checkpoint is not smaller or loses more than one case, do not use it as the default representation.",
      "If composition adds no paired successes or exceeds the cost bound, omit the redundant combined packet.",
      "Any false resume, old-action use, unresolved citation, or unrelated citation keeps automatic task resumption disabled."
    ],
    "prohibitedClaims": [
      "The deterministic reference reader cannot establish language-model, Agent, or Dolly product efficacy.",
      "This experiment does not test a public model, owner Aether, SSE transport, model reasoning, or model context behavior.",
      "This experiment does not test restart recovery, deletion propagation, namespace isolation, Scheduler integration, installed Module launch, or real tool effects.",
      "Repeated proximity is association evidence and never proof of position or causal semantics.",
      "No result may remove, weaken, or bypass the Module startup refusal."
    ]
  },
  "conditions": {
    "baselines": [
      {
        "id": "content-raw",
        "description": "Deterministic token-overlap retrieval returns at most four immutable raw source records without association expansion or a checkpoint.",
        "frozenParameters": {
          "maximumRecords": 4,
          "ranking": "descending distinct query-token overlap, descending source sequence, then source identifier",
          "checkpoint": false,
          "association": false
        }
      }
    ],
    "treatments": [
      {
        "id": "association-raw",
        "description": "At most two records reached through repeated adjacent token-pair evidence are placed before content records, deduplicated, and bounded to four raw records.",
        "frozenParameters": {
          "maximumAssociatedRecords": 2,
          "maximumRecords": 4,
          "recordDistance": 1,
          "minimumDistinctEpisodes": 2,
          "causalInterpretation": false
        }
      },
      {
        "id": "deterministic-checkpoint",
        "description": "A single closed task-state checkpoint is deterministically constructed from the exact association-raw packet and cites its underlying raw sources.",
        "frozenParameters": {
          "input": "byte-identical association-raw packet",
          "generatedTextAllowed": false,
          "maximumSourceHops": 1,
          "rawRecordsIncluded": false
        }
      },
      {
        "id": "checkpoint-association-raw",
        "description": "The identical deterministic checkpoint is prepended to the byte-identical association-raw packet without changing retrieval.",
        "frozenParameters": {
          "checkpoint": "byte-identical deterministic-checkpoint cell value",
          "rawEvidence": "byte-identical association-raw cell value",
          "maximumSourceHops": 1
        }
      }
    ]
  },
  "data": {
    "generatorOrDataset": {
      "id": "memory-factorial-deterministic-corpus",
      "version": "2",
      "contentDefinition": "A checked-in deterministic generator expands four base tasks into positive, explicit do-not-resume, cancelled, and superseded scenarios. Every scenario contains two independently sufficient paraphrased constraint records in distinct episodes, a current state, an identity distractor, and an explicit later state update when applicable."
    },
    "training": {
      "name": "training-reserved-unused",
      "seeds": [401, 402],
      "caseFactors": [
        "Reserved only for a future version; this version performs no training or tuning."
      ]
    },
    "development": {
      "name": "development-reserved-unused",
      "seeds": [451, 452],
      "caseFactors": [
        "Reserved only for a future version; all version-two rules were frozen before any formal result."
      ]
    },
    "evaluation": {
      "name": "evaluation",
      "seeds": [501, 502, 503, 504],
      "caseFactors": [
        "Two structured-data-import tasks and two software-incident tasks.",
        "Each seed expands into positive, do-not-resume, cancelled, and superseded cues.",
        "Each of sixteen scenarios is evaluated in four representation cells for exactly sixty-four case rows."
      ]
    },
    "splitIsolation": "Training and development identifiers are reserved and unused. Only evaluation seeds 501 through 504 are generated, and the active context uses separate identifiers from every memory source record.",
    "tuningUsesTrainingAndDevelopmentOnly": true
  },
  "backend": {
    "allowedKinds": ["local"],
    "requiredKind": "local",
    "silentFallbackAllowed": false,
    "credentialsRequired": false,
    "networkRequired": false
  },
  "randomness": {